Titel,Geschaeftsart,Status,Datum,Namen,Namen-neu,ID-Vorstoss
Pilotversuch einer Tagesschule in Adliswil,Motion,Abgelehnt,2021-09-22,"[' Acar Sait', ' Etemi Xhelajdin', 'Dr.  Liedtke Wolfgang', ' Muthuthamby Kannathasan', ' Yilmaz Esen', '', 'Katharina Willimann (Erstunterzeichner/in)']","['Acar Sait', 'Etemi Xhelajdin', 'Liedtke Wolfgang', 'Muthuthamby Kannathasan', 'Yilmaz Esen', 'Katharina Willimann']",140
Massnahmen zur Erreichung der Klimaziele,Dringliches Postulat,Abgelehnt,2019-04-05,"['Dr.  Liedtke Wolfgang', ' Etemi Xhelajdin', ' Muthuthamby Kannathasan', '', 'Angelika Sulser (Mitunterzeichner/in)']","['Liedtke Wolfgang', 'Etemi Xhelajdin', 'Muthuthamby Kannathasan', 'Angelika Sulser']",141
Günstiger Wohnraum in Adliswil,Interpellation,Beantwortet,2019-04-12,"[' Buchmann Reto', '', 'Patrick Sager (Erstunterzeichner/in)']","['Buchmann Reto', 'Patrick Sager']",142
Transparenz über die finanziellen Auswirkungen der Verdichtung mit Grossprojekten,Postulat,Abgeschrieben,2021-09-02,"[' Senn Mario', ' Clesle Hanspeter', ' Frei Daniel', ' Huber Sebastian']","['Senn Mario', 'Clesle Hanspeter', 'Frei Daniel', 'Huber Sebastian']",143
Stabilisierung des Finanzhaushaltes der Stadt Adliswil,Postulat,Abgeschrieben,2016-03-18,"['Dr. Bürgi Markus', ' Frei Daniel', '', 'Daniela Morf (keine Funktion)']","['Bürgi Markus', 'Frei Daniel', 'Daniela Morf']",144
Skateboard-Anlage Adliswil,Interpellation,Beantwortet,2014-05-07,['Mario F. Salomon (keine Funktion)'],['Mario F. Salomon'],145
Potentieller Missbrauch des Sozialhilfesystems durch Vermieter,Interpellation,Erledigt,2015-09-23,"['Dr. Bürgi Markus', '', 'Simone Huber (Zweitunterzeichner/in)']","['Bürgi Markus', 'Simone Huber']",146
Kücheneinbau im Kindergarten Hündli,Interpellation,Beantwortet,2011-03-15,[' Clesle Hanspeter'],['Clesle Hanspeter'],147
Kiss and Ride,Postulat,Nicht überwiesen,2011-01-12,['Peter Werder (keine Funktion)'],['Peter Werder'],148
Stadteigene Grundstücke,Interpellation,Beantwortet,2015-08-19,['Dr. Oswald Marianne'],['Oswald Marianne'],149
Kostendeckungsgrad der Schulergänzenden Angebote,Motion,Abgeschrieben,2015-01-28,"[' Frei Daniel', ' Senn Mario', '', 'Heidi Jucker (keine Funktion)']","['Frei Daniel', 'Senn Mario', 'Heidi Jucker']",150
Tiefackerstrasse,Interpellation,Beantwortet,2014-09-02,"[' Corrodi Bernie', ' Fässler Thomas']","['Corrodi Bernie', 'Fässler Thomas']",151
Umzug der Swiss Re,Interpellation,Erledigt,2016-02-10,"['Dr.  Liedtke Wolfgang', ' Marty Fässler Carmen', 'Dr. Oswald Marianne', '', 'Ueli Gräflein (Mitunterzeichner/in)']","['Liedtke Wolfgang', 'Marty Fässler Carmen', 'Oswald Marianne', 'Ueli Gräflein']",152
Führung und Steuerung Wohnen im Alter,Interpellation,Beantwortet,2019-07-03,"['Dr. Helbling Silvia', ' Corrodi Bernie', ' Iseli Thomas']","['Helbling Silvia', 'Corrodi Bernie', 'Iseli Thomas']",153
Entwicklung Lätten,Interpellation,Beantwortet,2021-06-02,"[' Senn Mario', ' Acar Sait', ' Clesle Hanspeter']","['Senn Mario', 'Acar Sait', 'Clesle Hanspeter']",154
Veloverkehrskonzept,Postulat,Abgeschrieben,2019-03-07,"['Dr. Oswald Marianne', 'Dr. Broggini Angela ', ' Schneider Daniel']","['Oswald Marianne', 'Broggini Angela', 'Schneider Daniel']",155
Hotellerietaxen in Adliswiler Pflegeeinrichtungen,Interpellation,Beantwortet,2019-03-07,"['Dr.  Liedtke Wolfgang', ' Acar Sait']","['Liedtke Wolfgang', 'Acar Sait']",156
Auflegen kostenloser Menstruationsartikel in Schulen,Anfrage,Beantwortet,2021-07-07,"['Dr. Oswald Marianne', 'Dr. Broggini Angela ', '', 'Katharina Willimann (Mitunterzeichner/in)\n Angelika Sulser (Mitunterzeichner/in)', '']","['Oswald Marianne', 'Broggini Angela', 'Katharina Willimann', 'Angelika Sulser']",157
Baurechte,Interpellation,Beantwortet,2019-07-01,"['Dr. Helbling Silvia', ' Mäder Gabriel', '', 'Stefan Neubert (Mitunterzeichner/in)\n Anke Würl (Mitunterzeichner/in)\n Patrick Sager (Mitunterzeichner/in)\n Walter Uebersax (Mitunterzeichner/in)', '', '', '']","['Helbling Silvia', 'Mäder Gabriel', 'Stefan Neubert', 'Anke Würl', 'Patrick Sager', 'Walter Uebersax']",158
Umstellung auf das Harmonisierte Rechnungsmodell 2 (HRM2),Interpellation,Beantwortet,2016-02-10,"['Dr. Bürgi Markus', ' Buchmann-Bach Vera', ' Senn Mario']","['Bürgi Markus', 'Buchmann-Bach Vera', 'Senn Mario']",159
Pilotprojekt ÖREB,Interpellation,Erledigt,2014-06-26,['Walter Uebersax (Erstunterzeichner/in)'],['Walter Uebersax'],160
Gemeindegrenzen und Neuplatzierung der Ortstafeln,Interpellation,Erledigt,2015-09-03,[' Acar Sait'],['Acar Sait'],161
Waffen in Adliswil,Interpellation,Beantwortet,2011-01-03,['Davide Loss (keine Funktion)'],['Davide Loss'],162
Littering,Interpellation,Beantwortet,2010-08-09,['Yannick Wettstein (keine Funktion)'],['Yannick Wettstein'],163
Badeanstalt Adliswil,Interpellation,Erledigt,2015-11-05,['Mario F. Salomon (keine Funktion)'],['Mario F. Salomon'],164
Städtische Beteiligungen an Unternehmungen,Postulat,Erledigt,2014-02-12,[' Senn Mario'],['Senn Mario'],165
Finanzverfassung der Stadt Adliswil,Motion,Abgeschrieben,2016-03-18,"[' Senn Mario', ' Baldegger Harry', '', 'Heidi Jucker (Mitunterzeichner/in)']","['Senn Mario', 'Baldegger Harry', 'Heidi Jucker']",166
Stadthausareal,Interpellation,Beantwortet,2019-09-04,"['Dr. Oswald Marianne', ' Corrodi Bernie', 'Dr.  Liedtke Wolfgang', ' Mäder Gabriel']","['Oswald Marianne', 'Corrodi Bernie', 'Liedtke Wolfgang', 'Mäder Gabriel']",167
Einführung von Betreuungsgutscheinen,Parlamentarische Initiative,Abgelehnt,2018-11-27,"['Dr.  Liedtke Wolfgang', 'Dr. Oswald Marianne', '', 'Anke Würl (Mitunterzeichner/in)']","['Liedtke Wolfgang', 'Oswald Marianne', 'Anke Würl']",168
Politisch aktiv in Adliswil,Interpellation,Beantwortet,2011-12-07,"[' Acar Sait', '', 'Peter Bühler (keine Funktion)']","['Acar Sait', 'Peter Bühler']",169
Gebühren an der Hauptentsorgungsstelle Adliswil Tüfi,Interpellation,Beantwortet,2023-02-02,"[' Muthuthamby Kannathasan', ' Acar Sait']","['Muthuthamby Kannathasan', 'Acar Sait']",170
Frühwarnsystem bei Unwetterkatastrophen,Interpellation,Beantwortet,2021-10-18,"[' Muthuthamby Kannathasan', '', 'Katharina Willimann (Erstunterzeichner/in)\n Angelika Sulser (Mitunterzeichner/in)', '']","['Muthuthamby Kannathasan', 'Katharina Willimann', 'Angelika Sulser']",171
Zahlen zur Sozialhilfe in Adliswil,Anfrage,Beantwortet,2021-09-22,[' Muthuthamby Kannathasan'],['Muthuthamby Kannathasan'],172
Energie aus Fluss-und Trinkwasser,Motion,Überwiesen,2023-02-02,"[' Baldegger Harry', ' Corrodi Bernie', ' Frei Daniel', ' Melliger Heinz']","['Baldegger Harry', 'Corrodi Bernie', 'Frei Daniel', 'Melliger Heinz']",173
Unterstützung der Charta für Lohngleichheit von Frau und Mann,Postulat,Teilweise überwiesen,2018-12-13,"['Dr.  Liedtke Wolfgang', 'Dr. Broggini Angela ', ' Muthuthamby Kannathasan', 'Dr. Oswald Marianne']","['Liedtke Wolfgang', 'Broggini Angela', 'Muthuthamby Kannathasan', 'Oswald Marianne']",174
Sonntagsverkäufe in Adliswil,Interpellation,Beantwortet,2011-10-14,[' Senn Mario'],['Senn Mario'],175
Verbesserung des Angebotes des öffentlichen Verkehrs in Adliswil,Postulat,Abgelehnt,2019-09-23,['Dr.  Liedtke Wolfgang'],['Liedtke Wolfgang'],176
Qualität der Finanzplanung,Postulat,Abgeschrieben,2016-03-18,"[' Engel Pascal', ' Frei Daniel', '', 'Fredi Morf (keine Funktion)']","['Engel Pascal', 'Frei Daniel', 'Fredi Morf']",177
Benützung der Garderoben und Duschen für Sporttreibende über Mittag,Postulat,,2014-03-05,[' Iseli Thomas'],['Iseli Thomas'],178
Umgang mit Gegenständen in Treppenhäusern und Hauseingängen,Interpellation,Erledigt,2015-11-05,"[' Acar Sait', '', 'Davide Loss (Erstunterzeichner/in)']","['Acar Sait', 'Davide Loss']",179
Sprayereien,Interpellation,Beantwortet,2010-09-16,[' Clesle Hanspeter'],['Clesle Hanspeter'],180
Bikesharing-Station am Bahnhof Adliswil,Interpellation,Beantwortet,2010-12-16,['Davide Loss (Verfasser/in)'],['Davide Loss'],181
Weiterbestand des Personalvereins Adliswil,Interpellation,Erledigt,2016-01-26,"[' Acar Sait', '', 'Davide Loss (Zweitunterzeichner/in)']","['Acar Sait', 'Davide Loss']",182
Neuerungen Kinterbetreuung,Interpellation,Beantwortet,2014-02-05,"[' Senn Mario', '', 'Simone Huber (keine Funktion)']","['Senn Mario', 'Simone Huber']",183
Bewilligungspraxis unbez. Urlaub Lehrpersonen,Interpellation,Beantwortet,2016-06-03,['Christoph Schwager (Verfasser/in)'],['Christoph Schwager'],184
Sharing Economy in Adliswil und an Adliswiler Bahnhöfen,Postulat,Abgelehnt,2019-07-26,"[' Buchmann Reto', ' Buchmann-Bach Vera']","['Buchmann Reto', 'Buchmann-Bach Vera']",185
Übertragung der Kompetenz zur Erteilung des Bürgerrechts der Stadt Adliswil bei Personen ohne Rechtsanspruch an den Stadtrat,Parlamentarische Initiative,Abgelehnt,2019-01-24,"[' Acar Sait', ' Etemi Xhelajdin']","['Acar Sait', 'Etemi Xhelajdin']",186
Attraktiverer öffentlicher Verkehr statt Staus und Mehrkosten,Postulat,Abgeschrieben,2021-11-23,"[' Buchmann-Bach Vera', ' Engel Pascal', ' Huber Sebastian']","['Buchmann-Bach Vera', 'Engel Pascal', 'Huber Sebastian']",187
Ist Adliswil bald zugebaut?,Interpellation,Beantwortet,2021-11-24,"['Dr. Oswald Marianne', 'Dr. Broggini Angela ', ' Schneider Daniel']","['Oswald Marianne', 'Broggini Angela', 'Schneider Daniel']",188
Für mehr preisgünstige Wohnungen,Interpellation,Beantwortet,2018-12-13,"[' Mäder Gabriel', '', 'Anke Würl (Mitunterzeichner/in)']","['Mäder Gabriel', 'Anke Würl']",189
Einsatz von Pflanzenschutzmittel in Adliswil,Interpellation,Beantwortet,2019-07-10,"['Dr. Oswald Marianne', '', 'Stefan Neubert (Mitunterzeichner/in)\n Anke Würl (Mitunterzeichner/in)\n Angelika Sulser (Mitunterzeichner/in)', '', '']","['Oswald Marianne', 'Stefan Neubert', 'Anke Würl', 'Angelika Sulser']",190
Stellenwechsel pro Ressort/Abteilung,Interpellation,Beantwortet,2016-05-20,"['Dr. Oswald Marianne', '', 'Ueli Gräflein (Erstunterzeichner/in)']","['Oswald Marianne', 'Ueli Gräflein']",191
Erstellung eines Intergrationskonzeptes,Postulat,Nicht überwiesen,2014-02-05,[' Acar Sait'],['Acar Sait'],192
Mehr Plakatstellen bzw. grössere Flächen für kulturelle Aktivitäten,Interpellation,Erledigt,2016-02-01,[' Corrodi Bernie'],['Corrodi Bernie'],193
Öffentliche Ordnung,Interpellation,Beantwortet,2010-11-01,"[' Acar Sait', ' Marty Fässler Carmen', '', 'Peter Bühler (keine Funktion)\n Davide Loss (keine Funktion)', '']","['Acar Sait', 'Marty Fässler Carmen', 'Peter Bühler', 'Davide Loss']",194
