Titel,Geschaeftsart,Status,Datum,Namen,Namen-neu,ID-Vorstoss
Städtische Beteiligung an Unternehmungen,Postulat,Abgeschrieben,2014-11-21,[' Senn Mario'],['Senn Mario'],1
ZKB Jubiläums-Dividende,Interpellation,Beantwortet,2019-11-06,"[' Mäder Gabriel', ' Schanz Simon', '', 'Stefan Neubert (Mitunterzeichner/in)\n Anke Würl (Mitunterzeichner/in)\n Martin Rüttimann (Mitunterzeichner/in)\n Walter Uebersax (Erstunterzeichner/in)', '', '', '']","['Mäder Gabriel', 'Schanz Simon', 'Stefan Neubert', 'Anke Würl', 'Martin Rüttimann', 'Walter Uebersax']",2
Zwischennutzung Stadthausareal,Postulat,Überwiesen,2011-09-07,[' Clesle Hanspeter'],['Clesle Hanspeter'],3
Anschluss des Quartiers Sonnenberg an den ÖV,Postulat,Abgelehnt,2022-12-15,"[' Muthuthamby Kannathasan', ' Acar Sait']","['Muthuthamby Kannathasan', 'Acar Sait']",4
Berücksichtigung von lokalen Handwerker u. Unternehmen bei Beauftragungen durch die Stadt Adliswil,Interpellation,Beantwortet,2022-12-16,[' Muthuthamby Kannathasan'],['Muthuthamby Kannathasan'],5
Sichere Schulwege im Soodstrassenbereich,Interpellation,Beantwortet,2011-09-21,[' Baldegger Harry'],['Baldegger Harry'],6
Geplante Verkehrsentwicklung,Interpellation,Beantwortet,2019-10-02,"[' Baldegger Harry', ' Mäder Gabriel', ' Melliger Heinz', '', 'Stefan Neubert (Erstunterzeichner/in)\n Anke Würl (Mitunterzeichner/in)\n Walter Uebersax (Mitunterzeichner/in)', '', '']","['Baldegger Harry', 'Mäder Gabriel', 'Melliger Heinz', 'Stefan Neubert', 'Anke Würl', 'Walter Uebersax']",7
Reorganisation der Schule Adliswil,Interpellation,Beantwortet,2014-11-17,"['Fredi Morf (keine Funktion)\n Heidi Jucker (keine Funktion)', '']","['Fredi Morf', 'Heidi Jucker']",8
Elternmitwirkung bei der Schülerzuteilung,Postulat,Erledigt,2014-11-06,[' Senn Mario'],['Senn Mario'],9
Sauberkeit im öffentlichen Raum,Anfrage,Beantwortet,2016-02-10,['Dr.  Liedtke Wolfgang'],['Liedtke Wolfgang'],10
Ortsbus-Erschliessung Quartier Sonnenberg,Interpellation,Beantwortet,2016-07-08,"[' Senn Mario', 'Dr. Bürgi Markus', ' Clesle Hanspeter']","['Senn Mario', 'Bürgi Markus', 'Clesle Hanspeter']",11
Selbständiges Wohnen im Alter,Interpellation,Beantwortet,2022-11-21,"[' Melliger Heinz', ' Baldegger Harry', ' Corrodi Bernie', ' Frei Daniel']","['Melliger Heinz', 'Baldegger Harry', 'Corrodi Bernie', 'Frei Daniel']",12
Organisation der Polizei in Adliswil,Interpellation,Beantwortet,2011-07-07,['Simone Huber (keine Funktion)'],['Simone Huber'],13
Einfluss der geplanten Projekte Sood/Lätten auf den Verkehr in Adliswil?,Anfrage,Beantwortet,2022-01-31,[' Mäder Gabriel'],['Mäder Gabriel'],14
Förderung und Schutz der Artenvielfalt,Postulat,Überwiesen,2021-12-16,"['Dr. Oswald Marianne', 'Dr. Broggini Angela ', ' Mäder Gabriel', ' Schneider Daniel', '', 'Walter Uebersax (Mitunterzeichner/in)']","['Oswald Marianne', 'Broggini Angela', 'Mäder Gabriel', 'Schneider Daniel', 'Walter Uebersax']",15
Mitnutzung ZIS-Turnhalle,Interpellation,Beantwortet,2011-06-22,"[' Marty Fässler Carmen', '', 'Daniel Jud (keine Funktion)']","['Marty Fässler Carmen', 'Daniel Jud']",16
Festlegung von Mindestanteilen für preisgünstigen Wohnraum in der BZO,Motion,Abgelehnt,2022-11-02,"[' Yilmaz Esen', ' Acar Sait', ' Etemi Xhelajdin', ' Muthuthamby Kannathasan']","['Yilmaz Esen', 'Acar Sait', 'Etemi Xhelajdin', 'Muthuthamby Kannathasan']",17
Neuregelung der Bestimmungen zum Umgang mit Überstundensaldi im Personalstatut,Interpellation,Beantwortet,2016-09-16,"['Dr. Bürgi Markus', ' Frei Daniel', ' Iseli Thomas', 'Dr.  Liedtke Wolfgang', ' Marty Fässler Carmen', '', 'Fredi Morf (Mitunterzeichner/in)\n Heidi Jucker (Mitunterzeichner/in)\n Daniela Morf (Mitunterzeichner/in)\n Walter Uebersax (Mitunterzeichner/in)', '', '', '']","['Bürgi Markus', 'Frei Daniel', 'Iseli Thomas', 'Liedtke Wolfgang', 'Marty Fässler Carmen', 'Fredi Morf', 'Heidi Jucker', 'Daniela Morf', 'Walter Uebersax']",18
Unterhalt der städtischen Liegenschaften,Interpellation,Beantwortet,2014-11-10,"['Dr. Oswald Marianne', '', 'Ueli Gräflein (keine Funktion)']","['Oswald Marianne', 'Ueli Gräflein']",19
Wiedereinführung der Sekundar C-Stufe als separater Klassenzug,Interpellation,Beantwortet,2016-02-01,[' Corrodi Bernie'],['Corrodi Bernie'],20
Tagesstrukturen im Schulhaus Dietlimoos,Postulat,Nicht überwiesen,2011-05-19,['Daniel Jud (keine Funktion)'],['Daniel Jud'],21
Krankenversicherungskosten im Sozialwesen,Interpellation,Beantwortet,2014-12-03,['Peter Werder (keine Funktion)'],['Peter Werder'],22
Sammlung von Plastikabfällen aller Art auf dem Stadtgebiet und Zuführung zur Wiederverwertung,Motion,Überwiesen,2022-02-02,"[' Corrodi Bernie', ' Baldegger Harry', ' Frei Daniel', ' Melliger Heinz']","['Corrodi Bernie', 'Baldegger Harry', 'Frei Daniel', 'Melliger Heinz']",23
Verkauf von städtischen Liegenschaften,Interpellation,Beantwortet,2011-05-24,['Ueli Gräflein (keine Funktion)'],['Ueli Gräflein'],24
Schulqualität fördern,Interpellation,Beantwortet,2019-05-29,[' Clesle Hanspeter'],['Clesle Hanspeter'],25
Schulhaus/Turnhalle Dietlimoos,Interpellation,Beantwortet,2011-06-08,"[' Clesle Hanspeter', ' Fässler Thomas']","['Clesle Hanspeter', 'Fässler Thomas']",26
5G Infrastruktur-Ausbau,Dringliches Postulat,Abgelehnt,2019-05-22,[' Engel Pascal'],['Engel Pascal'],27
Entwicklung der Mietzinse in Adliswil und Anpassung der Normmietzinsen in der Sozialhilfe 2012-2022,Interpellation,Beantwortet,2022-03-17,"[' Etemi Xhelajdin', ' Muthuthamby Kannathasan']","['Etemi Xhelajdin', 'Muthuthamby Kannathasan']",28
Areal der Stalder Transportunternehmung AG,Interpellation,Beantwortet,2014-12-03,"['Dr. Oswald Marianne', '', 'Ueli Gräflein (keine Funktion)']","['Oswald Marianne', 'Ueli Gräflein']",29
Unternehmens-Identifikationsnummer (UID),Interpellation,,2011-05-12,[' Senn Mario'],['Senn Mario'],30
Verbesserung des ÖV-Angebotes,Postulat,Nicht überwiesen,2014-12-04,['Peter Bühler (keine Funktion)'],['Peter Bühler'],31
Globalbudget betr. zusätzlichem Indikator beim Produkt Kultur,Postulat,Überwiesen,2011-06-17,"[' Clesle Hanspeter', '', 'Daniela Morf (keine Funktion)']","['Clesle Hanspeter', 'Daniela Morf']",32
Rückforderungen von Versorgertaxen vom Kanton Zürich,Interpellation,Beantwortet,2022-05-19,"['Christoph Gubser (Erstunterzeichner/in)\n Patrick Sager (Mitunterzeichner/in)', '']","['Christoph Gubser', 'Patrick Sager']",33
Wie schützt sich Adliswil vor Cyberangriffen?,Interpellation,Beantwortet,2022-04-28,"[' Buchmann-Bach Vera', '', 'Patrick Sager (Mitunterzeichner/in)']","['Buchmann-Bach Vera', 'Patrick Sager']",34
Schulzimmer Zentrum Kronenwiese,Interpellation,Beantwortet,2011-06-17,"[' Clesle Hanspeter', ' Senn Mario']","['Clesle Hanspeter', 'Senn Mario']",35
Fremdbetreuung von Kindern - Kostenübernahme,Interpellation,Beantwortet,2014-10-21,"['Dr. Bürgi Markus', ' Senn Mario']","['Bürgi Markus', 'Senn Mario']",36
Umfang von Beratungsleistungen in der Stadtverwaltung,Interpellation,Erledigt,2015-01-14,"['Dr.  Liedtke Wolfgang', '', 'Davide Loss (keine Funktion)']","['Liedtke Wolfgang', 'Davide Loss']",37
Ermässigung der Musikschulgebühren für Studierende,Motion,Nicht zustandegekommen,2021-03-12,"['Dr.  Liedtke Wolfgang', ' Etemi Xhelajdin', ' Yilmaz Esen', '', 'Angelika Sulser (Mitunterzeichner/in)']","['Liedtke Wolfgang', 'Etemi Xhelajdin', 'Yilmaz Esen', 'Angelika Sulser']",38
Parkplätze Sportanlage Tüfi,Interpellation,Erledigt,2015-05-07,[' Baldegger Harry'],['Baldegger Harry'],39
Adliswiler Stadtsaal - Wann löst der Stadtrat sein Versprechen ein?,Interpellation,Beantwortet,2020-04-15,"[' Acar Sait', ' Etemi Xhelajdin', 'Dr.  Liedtke Wolfgang']","['Acar Sait', 'Etemi Xhelajdin', 'Liedtke Wolfgang']",40
Auswirkungen der Lohnerhöhung beim städtischen Personal,Interpellation,Beantwortet,2023-03-08,"['Dr. Helbling Silvia', ' Iseli Thomas', ' Schweizer Rolf']","['Helbling Silvia', 'Iseli Thomas', 'Schweizer Rolf']",41
Finanzielle Situation Kinderhaus Werd,Interpellation,Beantwortet,2017-02-07,"[' Senn Mario', '', 'Marietta Werder (Erstunterzeichner/in)']","['Senn Mario', 'Marietta Werder']",42
Elektronische Beschlussdatenbank,Postulat,Abgeschrieben,2013-12-04,[' Senn Mario'],['Senn Mario'],43
Zahlungserinnerungen zur Verminderung von Steuerausfällen,Anfrage,Beantwortet,2016-12-09,"[' Acar Sait', ' Etemi Xhelajdin', '', 'Davide Loss (Erstunterzeichner/in)']","['Acar Sait', 'Etemi Xhelajdin', 'Davide Loss']",44
Quartierentwicklung Dietlimoos/Grütpark,Interpellation,Beantwortet,2014-02-05,[' Fässler Thomas'],['Fässler Thomas'],45
Interessenbindungen Behördenmitglieder,Anfrage,Beantwortet,2023-02-21,"[' Buchmann-Bach Vera', ' Geissler Heinz', 'Dr. Helbling Silvia']","['Buchmann-Bach Vera', 'Geissler Heinz', 'Helbling Silvia']",46
Wirtschaftsstrategie für Adliswil,Motion,Abgeschrieben,2020-06-03,"[' Senn Mario', ' Buchmann Reto', ' Clesle Hanspeter', ' Frei Daniel', '', 'Daniela Morf (Mitunterzeichner/in)\n Walter Uebersax (Mitunterzeichner/in)', '']","['Senn Mario', 'Buchmann Reto', 'Clesle Hanspeter', 'Frei Daniel', 'Daniela Morf', 'Walter Uebersax']",47
Sammlung von Plastikabfällen aller Art auf dem Stadtgebiet und Zuführung der Wiederverwertung,Interpellation,Beantwortet,2021-03-08,"[' Corrodi Bernie', ' Baldegger Harry', ' Frei Daniel', ' Melliger Heinz']","['Corrodi Bernie', 'Baldegger Harry', 'Frei Daniel', 'Melliger Heinz']",48
Steuerstatistik veröffentlichen,Interpellation,Beantwortet,2018-09-06,"[' Buchmann Reto', 'Dr. Helbling Silvia', ' Senn Mario']","['Buchmann Reto', 'Helbling Silvia', 'Senn Mario']",49
Verkehrsproblematik Schönauweg,Interpellation,Beantwortet,2021-04-01,"[' Baldegger Harry', ' Corrodi Bernie', ' Frei Daniel', ' Melliger Heinz']","['Baldegger Harry', 'Corrodi Bernie', 'Frei Daniel', 'Melliger Heinz']",50
Chancengleichheit bei Stellenbesetzungen in der Stadt- und Schulverwaltung,Anfrage,Beantwortet,2020-06-15,[' Muthuthamby Kannathasan'],['Muthuthamby Kannathasan'],51
"Aufwertung des Zentrum durch Kauf, Neubau und Verkauf von Liegenschaften an der Ablisstrasse",Postulat,Abgelehnt,2023-03-08,"[' Buchmann-Bach Vera', ' Geissler Heinz', ' Schweizer Rolf']","['Buchmann-Bach Vera', 'Geissler Heinz', 'Schweizer Rolf']",52
Neun Zivilschutzanlagen gehen zurück an die Gemeinden,Anfrage,Beantwortet,2017-02-22,['Heidi Jucker (Verfasser/in)'],['Heidi Jucker'],53
Aufwand für Förderung und Angebot von Kindern mit besonderen pädagogischen Bedürfnissen,Interpellation,Beantwortet,2017-03-09,"[' Jacomet Renato', ' Künzler Urs', '', 'Hedwig Habersaat (Mitunterzeichner/in)\n Mario F. Salomon (Erstunterzeichner/in)\n Heidi Jucker (Mitunterzeichner/in)\n Daniela Morf (Mitunterzeichner/in)\n Erwin Lauper (Mitunterzeichner/in)', '', '', '', '']","['Jacomet Renato', 'Künzler Urs', 'Hedwig Habersaat', 'Mario F. Salomon', 'Heidi Jucker', 'Daniela Morf', 'Erwin Lauper']",54
Stadtsaal,Anfrage,Beantwortet,2023-07-23,['Dr.  Liedtke Wolfgang'],['Liedtke Wolfgang'],55
Homeoffice in der Corona-Krise: Erkenntnisse aus der Stadtverwaltung,Interpellation,Beantwortet,2020-06-12,"[' Buchmann Reto', ' Frei Daniel']","['Buchmann Reto', 'Frei Daniel']",56
Hitzeminderung im Stadtgebiet,Interpellation,Beantwortet,2021-04-22,"['Dr. Oswald Marianne', 'Dr. Broggini Angela ', ' Schneider Daniel']","['Oswald Marianne', 'Broggini Angela', 'Schneider Daniel']",57
Aufwertung der Verkehrsleitungs-Kreisel auf der Albisstrasse,Motion,Abgelehnt,2018-08-21,"[' Corrodi Bernie', ' Schneider Daniel']","['Corrodi Bernie', 'Schneider Daniel']",58
Wann profitiert auch Adliswil von Umzonungen?,Anfrage,Beantwortet,2021-02-22,"[' Mäder Gabriel', ' Corrodi Bernie', 'Dr. Oswald Marianne', '', 'Walter Uebersax (Mitunterzeichner/in)']","['Mäder Gabriel', 'Corrodi Bernie', 'Oswald Marianne', 'Walter Uebersax']",59
Abfalltrennung bei öffentlichen Veranstaltungen  und in öffentlichen Gebäuden in der Stadt Adliswil,Postulat,Pendent Legislative,2023-11-16,"[' Corrodi Bernie', ' Muthuthamby Kannathasan', ' Welti Pascal']","['Corrodi Bernie', 'Muthuthamby Kannathasan', 'Welti Pascal']",60
Planung und Realisierung eines Gemeinschaftszentrums (GZ),Postulat,Abgelehnt,2020-01-08,"['Dr. Broggini Angela ', ' Corrodi Bernie', ' Mäder Gabriel', ' Yilmaz Esen', '', 'Angelika Sulser (Ersatzurheber/in)\n Walter Uebersax (Mitunterzeichner/in)', '']","['Broggini Angela', 'Corrodi Bernie', 'Mäder Gabriel', 'Yilmaz Esen', 'Angelika Sulser', 'Walter Uebersax']",61
Schliessung Vulkaro,Interpellation,Beantwortet,2013-05-08,['Daniel Jud (keine Funktion)'],['Daniel Jud'],62
Stadteigene Bauland-Parzellen B2 und C im Dietlimoos,Motion,Abgelehnt,2017-07-05,"['Dr. Oswald Marianne', ' Schneider Daniel', '', 'Daniel Jud (Mitunterzeichner/in)']","['Oswald Marianne', 'Schneider Daniel', 'Daniel Jud']",63
Lärm durch Nationalstrasse,Interpellation,Beantwortet,2017-06-22,[' Fässler Thomas'],['Fässler Thomas'],64
Kulturlandinitiative und weitere Bautätigkeit im Gebiet Dietlimoos/Moos,Interpellation,Beantwortet,2013-06-05,['Yannick Wettstein (keine Funktion)'],['Yannick Wettstein'],65
Altpapiersammlung durch Vereine in Adliswil,Interpellation,Beantwortet,2020-03-04,"[' Baldegger Harry', ' Corrodi Bernie', ' Frei Daniel', ' Melliger Heinz']","['Baldegger Harry', 'Corrodi Bernie', 'Frei Daniel', 'Melliger Heinz']",66
Kronenwiese- Schulareal zur Entsiegelung und Hitzeminderung,Interpellation,Pendent Legislative,2023-11-02,"[' Schoch Jacqueline ', ' Corrodi Bernie', ' Kälin Florian', ' Mäder Gabriel']","['Schoch Jacqueline', 'Corrodi Bernie', 'Kälin Florian', 'Mäder Gabriel']",67
Massvolle Verdichtung statt Grossüberbauung und Hochhäuser,Postulat,Abgeschrieben,2020-12-09,"[' Senn Mario', ' Frei Daniel', '', 'Daniela Morf (Mitunterzeichner/in)']","['Senn Mario', 'Frei Daniel', 'Daniela Morf']",68
Verbesserung und Ausbau der Buslinie 151 (Zopf-Quartier),Motion,Abgeschrieben,2020-11-27,"[' Corrodi Bernie', ' Baldegger Harry', ' Frei Daniel', ' Melliger Heinz']","['Corrodi Bernie', 'Baldegger Harry', 'Frei Daniel', 'Melliger Heinz']",69
Neues Nutzungskonzept für die Tiefgarage Zentrum,Postulat,Pendent Legislative,2023-09-21,"[' Mäder Gabriel', ' Engel Pascal', ' Schanz Simon']","['Mäder Gabriel', 'Engel Pascal', 'Schanz Simon']",70
Energieversorgung von neuen Wärmepumpen in Adliswil,Interpellation,Beantwortet,2019-12-18,"[' Schanz Simon', ' Mäder Gabriel', '', 'Stefan Neubert (Mitunterzeichner/in)\n Anke Würl (Mitunterzeichner/in)\n Martin Rüttimann (Mitunterzeichner/in)\n Walter Uebersax (Mitunterzeichner/in)', '', '', '']","['Schanz Simon', 'Mäder Gabriel', 'Stefan Neubert', 'Anke Würl', 'Martin Rüttimann', 'Walter Uebersax']",71
Fussgängerstreifen Leimbachstrasse,Postulat,Überwiesen,2010-06-23,[' Clesle Hanspeter'],['Clesle Hanspeter'],72
Altersgerechte Politik in Adliswil,Interpellation,Beantwortet,2017-05-10,['Dr.  Liedtke Wolfgang'],['Liedtke Wolfgang'],73
200-Watt-Gesellschaft,Postulat,Beantwortet,2009-02-05,[' Fässler Thomas'],['Fässler Thomas'],74
Energiebuchhaltung,Interpellation,Beantwortet,2008-11-26,['Yannick Wettstein (keine Funktion)'],['Yannick Wettstein'],75
Reduktion von Strassenlärm in Adliswil,Interpellation,Beantwortet,2017-06-07,['Dr.  Liedtke Wolfgang'],['Liedtke Wolfgang'],76
Grundstückverzeichnis,Interpellation,Beantwortet,2019-11-06,"[' Corrodi Bernie', ' Baldegger Harry', ' Frei Daniel', ' Melliger Heinz']","['Corrodi Bernie', 'Baldegger Harry', 'Frei Daniel', 'Melliger Heinz']",77
Schulhausparkplätze in Adliswil,Interpellation,Beantwortet,2010-08-04,[' Senn Mario'],['Senn Mario'],78
Gleichberechtigung der Entschädigung beim Zeitungssammeln,Interpellation,Pendent Legislative,2023-09-21,[' Schanz Simon'],['Schanz Simon'],79
Verbesserung und Ausbau der Buslinie 153 (Sonnenberg-Quartier),Motion,Abgeschrieben,2020-11-27,"[' Corrodi Bernie', ' Baldegger Harry', ' Frei Daniel', ' Melliger Heinz']","['Corrodi Bernie', 'Baldegger Harry', 'Frei Daniel', 'Melliger Heinz']",80
Programmierunterricht an der Schule Adliswil,Interpellation,Beantwortet,2017-10-05,"['Dr. Bürgi Markus', ' Frei Daniel', ' Senn Mario']","['Bürgi Markus', 'Frei Daniel', 'Senn Mario']",81
Veröffentlichung der Arbeitslosenzahlen,Interpellation,Beantwortet,2015-02-05,['Mario F. Salomon (keine Funktion)'],['Mario F. Salomon'],82
Flächendeckende Schulsozialarbeit,Motion,Erledigt,2010-01-11,['Yannick Wettstein (keine Funktion)'],['Yannick Wettstein'],83
Zwischenberichterstattung finanzielle Entwicklung,Postulat,Beantwortet,2013-03-06,[' Iseli Thomas'],['Iseli Thomas'],84
Änderungen im übergeordneten Recht und ihr finanzielle Auswirkungen auf Adliswil,Interpellation,Beantwortet,2013-07-03,[' Senn Mario'],['Senn Mario'],85
Zustände in der Notunterkunft (NUK) Adliswil,Interpellation,Beantwortet,2017-07-11,[' Engel Pascal'],['Engel Pascal'],86
Strassenbeleuchtung bei Bedarf,Interpellation,Beantwortet,2008-04-15,[' Fässler Thomas'],['Fässler Thomas'],87
Lärmschutz Zürichstrasse,Interpellation,Beantwortet,2008-03-06,['Davide Loss (keine Funktion)'],['Davide Loss'],88
Erfassung von 1. Mahnungen,Postulat,Nicht überwiesen,2013-07-03,[' Senn Mario'],['Senn Mario'],89
Datensicherheit in der Stadtverwaltung Adliswil,Interpellation,Beantwortet,2017-07-12,['Dr.  Liedtke Wolfgang'],['Liedtke Wolfgang'],90
Nutzung von Synergien mit der ZIS,Interpellation,Beantwortet,2013-03-06,['Simone Huber (keine Funktion)'],['Simone Huber'],91
Schliessung der Geburtenabteilung Spital Sanitas,Interpellation,Beantwortet,2010-01-25,['Davide Loss (keine Funktion)'],['Davide Loss'],92
Zusammenarbeit mit der Kindes- und Erwachsenenschutzbehörde des Bezirks Horgen,Interpellation,Beantwortet,2015-02-05,"['Daniel Jud (keine Funktion)\n Davide Loss (keine Funktion)', '']","['Daniel Jud', 'Davide Loss']",93
Bahnhof Adliswil direkter Zugang von der Passerelle zu den Gleisen,Postulat,Abgelehnt,2017-08-31,"[' Fässler Thomas', '', 'Andrea Blümli (Mitunterzeichner/in)\n Anke Würl (Verfasser/in)', '']","['Fässler Thomas', 'Andrea Blümli', 'Anke Würl']",94
Gemeinnütziger Wohnungsbau im Dietlimoos,Motion,Abgelehnt,2017-08-15,"['Dr.  Liedtke Wolfgang', 'Dr. Oswald Marianne', '', 'Daniel Jud (Erstunterzeichner/in)']","['Liedtke Wolfgang', 'Oswald Marianne', 'Daniel Jud']",95
"Kostendeckungsgrade, Gebühren und Steuern",Interpellation,Erledigt,2015-03-03,"['Yannick Wettstein (keine Funktion)\n Peter Werder (keine Funktion)', '']","['Yannick Wettstein', 'Peter Werder']",96
Kostendeckende Einbürgerungsgebühren,Motion,Überwiesen,2010-05-13,[' Senn Mario'],['Senn Mario'],97
Grundstückgewinnsteuer,Interpellation,Beantwortet,2012-12-05,['Daniel Jud (keine Funktion)'],['Daniel Jud'],98
Sihlwald für alle,Interpellation,Beantwortet,2013-07-03,[' Fässler Thomas'],['Fässler Thomas'],99
Neuer linksseitiger Sihluferweg mit Wegbeleuchtung,Motion,Erledigt,2008-08-17,['Fredi Morf (keine Funktion)'],['Fredi Morf'],100
"Bauvorhaben der Schule, befristetes Aufstellen von 11 Schulcontainern",Interpellation,Erledigt,2008-09-03,['Fredi Morf (keine Funktion)'],['Fredi Morf'],101
Busbahnhof Adliswil und Haltestellen,Interpellation,Beantwortet,2013-07-03,[' Acar Sait'],['Acar Sait'],102
Rechte und Pflichten der Stadt Adliswil gegenüber der Stiftung für Altersbauten (SABA),Interpellation,Beantwortet,2012-12-12,"[' Baldegger Harry', ' Frei Daniel']","['Baldegger Harry', 'Frei Daniel']",103
Verhälntnis der Stadt Adliswil zu Privatschulen in Adliswil,Anfrage,Beantwortet,2010-01-28,['Davide Loss (Verfasser/in)'],['Davide Loss'],104
Baulandreserven in Adliswil,Interpellation,Erledigt,2015-03-05,['Mario F. Salomon (keine Funktion)'],['Mario F. Salomon'],105
Generationenübergreifendes Gemeinschaftszentrum GZ,Interpellation,Beantwortet,2017-08-24,['Walter Uebersax (Verfasser/in)'],['Walter Uebersax'],106
Mitteilung von Beschlüssen der Schulpflege,Postulat,Erledigt,2018-02-08,"[' Etemi Xhelajdin', 'Dr.  Liedtke Wolfgang', '', 'Davide Loss (Erstunterzeichner/in)']","['Etemi Xhelajdin', 'Liedtke Wolfgang', 'Davide Loss']",107
Vervollständigung der Schulintegration,Motion,Abgeschrieben,2015-04-02,"[' Meier Theo', ' Senn Mario', '', 'Heidi Jucker (keine Funktion)']","['Meier Theo', 'Senn Mario', 'Heidi Jucker']",108
Steuerpolitik der Stadt Adliswil,Interpellation,Beantwortet,2009-11-17,['Yannick Wettstein (keine Funktion)'],['Yannick Wettstein'],109
Aufhebung Schulbaurichtlinien,Interpellation,Beantwortet,2012-03-07,[' Senn Mario'],['Senn Mario'],110
Einführung von Biogas,Postulat,Nicht überwiesen,2013-11-06,"[' Fässler Thomas', '', 'Ueli Gräflein (keine Funktion)']","['Fässler Thomas', 'Ueli Gräflein']",111
Ersatzlösung für die Anbindung des Quartier Sonnenberg an das öffentliche Verkehrsnetz,Postulat,Erledigt,2007-12-03,['Davide Loss (keine Funktion)'],['Davide Loss'],112
Integration des Quartiers Sonnenberg in das öffentliche Vekehrsnetz,Interpellation,Beantwortet,2007-06-27,['Davide Loss (Verfasser/in)'],['Davide Loss'],113
Auswirkung der Schülerzahlen auf die Schule Adliswil,Interpellation,Beantwortet,2013-11-06,['Davide Loss (keine Funktion)'],['Davide Loss'],114
Schliessung der Poststelle Adliswil 2 (Sood),Anfrage,Beantwortet,2012-01-12,['Davide Loss (Verfasser/in)'],['Davide Loss'],115
Umsetzung Schulreform,Interpellation,Beantwortet,2009-12-08,[' Clesle Hanspeter'],['Clesle Hanspeter'],116
Parkplatzbewirtschaftung der Liegenschaften Stadt Adliswil,Interpellation,Erledigt,2015-03-26,[' Corrodi Bernie'],['Corrodi Bernie'],117
Einsatz von Drohnen und Multikoptern,Interpellation,Beantwortet,2018-01-18,"[' Fässler Thomas', '', 'Simon Pfenninger (Erstunterzeichner/in)\n Andrea Blümli (Mitunterzeichner/in)\n Anke Würl (Mitunterzeichner/in)\n Walter Uebersax (Mitunterzeichner/in)', '', '', '']","['Fässler Thomas', 'Simon Pfenninger', 'Andrea Blümli', 'Anke Würl', 'Walter Uebersax']",118
Mittel und Gegenstände (MiGeL); Pflegefinanzierung,Anfrage,Beantwortet,2018-02-27,['Heidi Jucker (Verfasser/in)'],['Heidi Jucker'],119
E-Velo Rikscha Fahrten für betagte Menschen,Interpellation,Beantwortet,2021-06-02,"[' Acar Sait', ' Etemi Xhelajdin', 'Dr.  Liedtke Wolfgang', ' Muthuthamby Kannathasan', ' Yilmaz Esen', '', 'Katharina Willimann (Erstunterzeichner/in)\n Angelika Sulser (Mitunterzeichner/in)', '']","['Acar Sait', 'Etemi Xhelajdin', 'Liedtke Wolfgang', 'Muthuthamby Kannathasan', 'Yilmaz Esen', 'Katharina Willimann', 'Angelika Sulser']",120
Mindereinnahmen durch Abschaffung und Senkung von Steuern und Gebühren,Interpellation,Erledigt,2015-03-18,['Davide Loss (keine Funktion)'],['Davide Loss'],121
Förderprogramm für Solaranlagen,Postulat,Erledigt,2009-09-11,[' Fässler Thomas'],['Fässler Thomas'],122
Gebühren bei Umstellung auf nachhaltiges Heizsystem,Postulat,Abgelehnt,2020-07-01,"[' Mäder Gabriel', ' Schanz Simon', '', 'Stefan Neubert (Mitunterzeichner/in)\n Anke Würl (Mitunterzeichner/in)\n Martin Rüttimann (Mitunterzeichner/in)\n Walter Uebersax (Erstunterzeichner/in)', '', '', '']","['Mäder Gabriel', 'Schanz Simon', 'Stefan Neubert', 'Anke Würl', 'Martin Rüttimann', 'Walter Uebersax']",123
Misstrauen gegen Stadtrat Mueller und Falbriard,Postulat,Abgeschrieben,2012-04-04,"[' Senn Mario', '', 'Fredi Morf (keine Funktion)']","['Senn Mario', 'Fredi Morf']",124
Strom ohne Atom,Postulat,Nicht überwiesen,2013-09-04,['Ueli Gräflein (keine Funktion)'],['Ueli Gräflein'],125
Parkierungskonzept im Tal,Postulat,Erledigt,2005-12-07,['Fredi Morf (keine Funktion)'],['Fredi Morf'],126
Entwicklung im öffentlichen Verkehr,Interpellation,Beantwortet,2007-06-04,['Davide Loss (Verfasser/in)'],['Davide Loss'],127
Schaffung einer gesetzlichen Grundlage für die Einsetzung einer Parlamentarischen Untersuchungskommission (PUK),Motion,Beschlossen,2013-09-04,"[' Clesle Hanspeter', ' Fässler Thomas', ' Senn Mario', '', 'Ueli Gräflein (keine Funktion)\n Fredi Morf (keine Funktion)\n Davide Loss (keine Funktion)', '', '']","['Clesle Hanspeter', 'Fässler Thomas', 'Senn Mario', 'Ueli Gräflein', 'Fredi Morf', 'Davide Loss']",128
Auswirkung der Kulturlandinitiative,Interpellation,Beantwortet,2012-10-03,['Yannick Wettstein (keine Funktion)'],['Yannick Wettstein'],129
"Sihlhochwasser, - Überschwemmung",Interpellation,Beantwortet,2009-05-04,[' Clesle Hanspeter'],['Clesle Hanspeter'],130
Adliswiler Zentrum aufwerten,Postulat,Abgelehnt,2020-09-23,"[' Schanz Simon', '', 'Anke Würl (Mitunterzeichner/in)\n Martin Rüttimann (Erstunterzeichner/in)\n Walter Uebersax (Mitunterzeichner/in)', '', '']","['Schanz Simon', 'Anke Würl', 'Martin Rüttimann', 'Walter Uebersax']",131
Übertragung der Kompetenzen zur Erteilung des Adliswiler Bürgerrechts an Ausländerinnen und Ausländer ohne Rechtsanspruch an den Stadtrat,Motion,Nicht überwiesen,2015-03-18,"[' Marty Fässler Carmen', '', 'Davide Loss (keine Funktion)']","['Marty Fässler Carmen', 'Davide Loss']",132
Geplante grosse Überbauungen in Adliswil,Interpellation,Beantwortet,2021-05-21,"['Dr. Helbling Silvia', ' Senn Mario']","['Helbling Silvia', 'Senn Mario']",133
Wählerverwirrung bei der Stadtpräsidiumswahl,Interpellation,Beantwortet,2018-07-05,"[' Clesle Hanspeter', ' Melliger Heinz', '', 'Daniela Morf (Mitunterzeichner/in)']","['Clesle Hanspeter', 'Melliger Heinz', 'Daniela Morf']",134
Papierverbrauch in der Stadtverwaltung,Interpellation,Beantwortet,2011-02-04,['Davide Loss (keine Funktion)'],['Davide Loss'],135
Adliswil und die 2000-Watt-Gesellschaft,Interpellation,Erledigt,2015-11-02,"['Dr. Bürgi Markus', ' Senn Mario', '', 'Daniela Morf (keine Funktion)']","['Bürgi Markus', 'Senn Mario', 'Daniela Morf']",136
Gemeinderating von Solidar Suisse,Interpellation,Beantwortet,2014-04-16,['Simon Jacoby (keine Funktion)'],['Simon Jacoby'],137
Zusatzkredite,Interpellation,Beantwortet,2016-03-16,"['Fredi Morf (Mitunterzeichner/in)\n Heidi Jucker (Erstunterzeichner/in)\n Daniela Morf (Mitunterzeichner/in)', '', '']","['Fredi Morf', 'Heidi Jucker', 'Daniela Morf']",138
Gebühren am Onlineschalter,Motion,Beschlossen,2019-06-06,"[' Buchmann Reto', ' Schanz Simon']","['Buchmann Reto', 'Schanz Simon']",139
